id,title,slug,description,overview,image,venue,location,date,time,mode,audience,agenda,organizer,tags,created_at,updated_at
550e8400-e29b-41d4-a716-446655440001,React Summit US 2025,react-summit-us-2025,"Join the largest React conference in the US with talks from core team members and industry leaders.","A two-day conference covering React 19, Server Components, and modern frontend architecture.",/images/event1.png,Moscone Center,San Francisco CA USA,2025-11-07,09:00,offline,Frontend developers and React engineers,"{""Keynote: The Future of React"",""Advanced Patterns in Server Components"",""Performance Optimization Workshop"",""Panel: React Ecosystem 2025""}",React Summit,{"React","Frontend","JavaScript","Conference"},2025-01-15T10:00:00Z,2025-01-15T10:00:00Z
550e8400-e29b-41d4-a716-446655440002,KubeCon + CloudNativeCon Europe 2026,kubecon-cloudnativecon-eu-2026,"The premier conference for cloud native and Kubernetes communities in Europe.","Explore Kubernetes, CNCF projects, and cloud native best practices with hands-on workshops.",/images/event2.png,Austria Center Vienna,Vienna Austria,2026-03-18,10:00,hybrid,DevOps engineers and platform teams,"{""Kubernetes Day"",""Service Mesh Deep Dive"",""Observability with OpenTelemetry"",""Cloud Native Security""}",CNCF,{"Kubernetes","Cloud Native","DevOps","CNCF"},2025-01-15T10:00:00Z,2025-01-15T10:00:00Z
550e8400-e29b-41d4-a716-446655440003,AWS re:Invent 2025,aws-reinvent-2025,"Amazon Web Services annual conference featuring keynotes and 2000+ sessions.","Discover the latest AWS services, AI/ML innovations, and cloud architecture patterns.",/images/event3.png,Las Vegas Convention Center,Las Vegas NV USA,2025-12-01,08:30,offline,Cloud architects and AWS practitioners,"{""CEO Keynote"",""Generative AI on AWS"",""Well-Architected Framework"",""Hands-on Labs""}",Amazon Web Services,{"AWS","Cloud","Serverless","AI"},2025-01-15T10:00:00Z,2025-01-15T10:00:00Z
550e8400-e29b-41d4-a716-446655440004,Next.js Conf 2025,nextjs-conf-2025,"The official Next.js conference with announcements from the Vercel team.","Learn about Next.js 16, Turbopack, and the future of full-stack React development.",/images/event4.png,LA Convention Center,Los Angeles CA USA,2025-11-12,09:30,hybrid,Full-stack developers and Next.js users,"{""Next.js 16 Announcement"",""App Router Best Practices"",""Deploying at Scale"",""Community Showcase""}",Vercel,{"Next.js","React","Full Stack","Vercel"},2025-01-15T10:00:00Z,2025-01-15T10:00:00Z
550e8400-e29b-41d4-a716-446655440005,Google Cloud Next 2026,google-cloud-next-2026,"Google Cloud's flagship event for developers, IT leaders, and partners.","Explore GCP services, Gemini AI integration, and enterprise cloud solutions.",/images/event5.png,McEnery Convention Center,San Jose CA USA,2026-04-07,09:00,offline,Cloud engineers and data professionals,"{""Google Cloud Vision Keynote"",""Gemini for Developers"",""BigQuery & Data Analytics"",""Security & Compliance""}",Google Cloud,{"Google Cloud","GCP","AI","Data"},2025-01-15T10:00:00Z,2025-01-15T10:00:00Z
550e8400-e29b-41d4-a716-446655440006,ETHGlobal Hackathon: Paris 2026,ethglobal-paris-2026,"A 36-hour hackathon focused on Ethereum and Web3 innovation in Paris.","Build decentralized apps, connect with Web3 founders, and compete for prizes.",/images/event6.png,Station F,Paris France,2026-07-10,10:00,offline,Web3 developers and blockchain enthusiasts,"{""Opening Ceremony"",""Workshop: Smart Contracts"",""Mentor Office Hours"",""Demo Day & Awards""}",ETHGlobal,{"Web3","Ethereum","Blockchain","Hackathon"},2025-01-15T10:00:00Z,2025-01-15T10:00:00Z
550e8400-e29b-41d4-a716-446655440007,Open Source Summit North America 2026,oss-na-2026,"The leading conference for open source developers, maintainers, and community leaders.","Sessions on Linux, open source governance, and collaborative development.",/images/events-full.png,Vancouver Convention Centre,Vancouver Canada,2026-06-22,09:00,hybrid,Open source contributors and maintainers,"{""State of Open Source"",""Maintainer Burnout & Sustainability"",""Linux Kernel Updates"",""Community Building""}",Linux Foundation,{"Open Source","Linux","Community","Developer"},2025-01-15T10:00:00Z,2025-01-15T10:00:00Z
